{
  "dataset_version": "outcome_dataset_v1",
  "rubric_version": "outcome_dimension_v1",
  "entry_contract": {
    "mode": "fixed_approved_plan",
    "message_template": "下面是我已经确认的实施方案。请直接按方案执行，完成 Validator 和真实视觉检查后汇报；不要修改方案范围外的表面。\n\n{approved_plan}"
  },
  "subsets": {
    "smoke_6": [
      "public_bright_calm_01",
      "small_bedroom_simple_03",
      "public_single_wallpaper_04",
      "foyer_lengthwise_order_05",
      "public_dining_continuity_06",
      "kitchen_public_transition_07"
    ],
    "full_12": [
      "public_bright_calm_01",
      "master_bedroom_restful_02",
      "small_bedroom_simple_03",
      "public_single_wallpaper_04",
      "foyer_lengthwise_order_05",
      "public_dining_continuity_06",
      "kitchen_public_transition_07",
      "master_suite_continuity_08",
      "guest_bath_low_complexity_09",
      "public_ceiling_restrained_10",
      "single_wall_temperature_11",
      "whole_home_warm_cohesive_12"
    ]
  },
  "scenarios": [
    {
      "scenario_id": "public_bright_calm_01",
      "title": "明亮安静的横厅客厅",
      "tags": ["single_room", "public", "smoke", "baseline"],
      "confirmed_requirements": [
        "范围仅为横厅客厅的墙面、地面和顶面",
        "整体明亮、安静、自然，不偏黄也不冰冷",
        "墙面属于同一暖中性色家族，不设置强图案",
        "浅色低色差木地面，吊顶视觉克制"
      ],
      "approved_plan": "横厅客厅采用明亮安静的暖中性方案：大面墙使用浅档暖白或 Greige 哑光，所有墙面保持同一色温家族；地面使用浅色、低色差的自然木；吊顶采用平顶或非常克制的细薄周边层次，不成为第一视觉焦点；不加入高对比图案，只修改横厅客厅。",
      "allowed_room_ids": ["open_public"],
      "allowed_target_ids": [
        "wall_face_real4_002", "wall_face_real4_010", "wall_face_real4_013",
        "wall_face_real4_022", "wall_face_real4_028", "wall_face_real4_032",
        "surface_real4_floor_open_public", "surface_real4_ceiling_open_public"
      ],
      "required_visual_criteria": [
        "intent_matches_image", "wall_floor_color_relation", "ceiling_visual_priority",
        "same_room_wall_family", "single_wall_temperature_consistency"
      ],
      "capture_plan": [
        {
          "capture_id": "public_room",
          "tool": "observe_room",
          "room_id": "open_public",
          "focus_target_ids": [
            "wall_face_real4_002", "wall_face_real4_010", "wall_face_real4_013",
            "wall_face_real4_022", "wall_face_real4_028", "wall_face_real4_032",
            "surface_real4_floor_open_public", "surface_real4_ceiling_open_public"
          ],
          "minimum_image_count": 3,
          "covers_criteria": [
            "intent_matches_image", "wall_floor_color_relation", "ceiling_visual_priority",
            "same_room_wall_family", "single_wall_temperature_consistency"
          ]
        }
      ],
      "grader_focus": "先判断整体是否明亮安静，再检查墙地色温、各墙统一性和吊顶是否抢戏。"
    },
    {
      "scenario_id": "master_bedroom_restful_02",
      "title": "克制包裹感主卧",
      "tags": ["single_room", "bedroom", "dark_tone"],
      "confirmed_requirements": [
        "范围仅为主卧",
        "安静、有轻度包裹感，但不能压暗或沉重",
        "床头墙可以略深，其余墙面必须协调",
        "木地面低对比，吊顶保持安静"
      ],
      "approved_plan": "主卧使用低饱和 Greige 或灰棕体系：床头完整墙面可以比其余墙面深一个层级形成轻焦点，其余墙面保持同族浅色；地面选择纹理克制的自然木；顶面保持平整安静。不得使用近黑墙面、强图案或高色差地板，只修改主卧。",
      "allowed_room_ids": ["master_bedroom"],
      "allowed_target_ids": [
        "wall_face_real4_007", "wall_face_real4_014", "wall_face_real4_015",
        "surface_real4_floor_master_bedroom", "surface_real4_ceiling_master_bedroom"
      ],
      "required_visual_criteria": [
        "intent_matches_image", "wall_floor_color_relation", "ceiling_visual_priority", "same_room_wall_family"
      ],
      "capture_plan": [
        {
          "capture_id": "master_bedroom",
          "tool": "observe_room",
          "room_id": "master_bedroom",
          "focus_target_ids": [
            "wall_face_real4_007", "wall_face_real4_014", "wall_face_real4_015",
            "surface_real4_floor_master_bedroom", "surface_real4_ceiling_master_bedroom"
          ],
          "minimum_image_count": 3,
          "covers_criteria": [
            "intent_matches_image", "wall_floor_color_relation", "ceiling_visual_priority", "same_room_wall_family"
          ]
        }
      ],
      "grader_focus": "区分有包裹感和整体压暗；床头墙应是同族层级变化，而不是另一套色卡。"
    },
    {
      "scenario_id": "small_bedroom_simple_03",
      "title": "小次卧明亮低复杂度",
      "tags": ["single_room", "small_room", "smoke", "complexity"],
      "confirmed_requirements": [
        "范围仅为北次卧",
        "小空间要显得明亮、放松、容易长期使用",
        "不使用深墙、深地和明显图案的叠加",
        "只允许一个很弱的层次变化"
      ],
      "approved_plan": "北次卧以浅暖白或浅 Greige 哑光墙面为主，可有一面低对比同族浅色墙作为弱层次；地面使用浅色低纹理木材；顶面保持平顶。不得同时出现深色墙、深色地面或强图案，只修改北次卧。",
      "allowed_room_ids": ["bedroom_2"],
      "allowed_target_ids": [
        "wall_face_real4_020", "wall_face_real4_021", "wall_face_real4_023", "wall_face_real4_025",
        "surface_real4_floor_bedroom_2", "surface_real4_ceiling_bedroom_2"
      ],
      "required_visual_criteria": [
        "intent_matches_image", "strong_pattern_competition", "wall_floor_color_relation",
        "same_room_wall_family", "small_room_complexity"
      ],
      "capture_plan": [
        {
          "capture_id": "small_bedroom",
          "tool": "observe_room",
          "room_id": "bedroom_2",
          "focus_target_ids": [
            "wall_face_real4_020", "wall_face_real4_021", "wall_face_real4_023", "wall_face_real4_025",
            "surface_real4_floor_bedroom_2", "surface_real4_ceiling_bedroom_2"
          ],
          "minimum_image_count": 3,
          "covers_criteria": [
            "intent_matches_image", "strong_pattern_competition", "wall_floor_color_relation",
            "same_room_wall_family", "small_room_complexity"
          ]
        }
      ],
      "grader_focus": "重点检查小空间是否因深色和图案叠加而拥挤，以及弱层次是否仍属于同一体系。"
    },
    {
      "scenario_id": "public_single_wallpaper_04",
      "title": "横厅单一完整墙纸焦点",
      "tags": ["single_room", "wallpaper", "smoke", "focal_control"],
      "confirmed_requirements": [
        "范围仅为横厅客厅",
        "只设置一面墙纸焦点墙，并选择尽量完整、少被门窗切割的墙面",
        "其余墙面、地面和顶面都要安静",
        "同一画面不能再出现第二种强图案"
      ],
      "approved_plan": "在横厅客厅选择一面完整度最高的主墙使用低对比、可独立成景的墙纸作为唯一焦点；其余墙面统一使用浅暖中性哑光墙漆，地面使用安静的浅自然木，顶面保持平整克制。不得增加第二种强图案，只修改横厅客厅。",
      "allowed_room_ids": ["open_public"],
      "allowed_target_ids": [
        "wall_face_real4_002", "wall_face_real4_010", "wall_face_real4_013",
        "wall_face_real4_022", "wall_face_real4_028", "wall_face_real4_032",
        "surface_real4_floor_open_public", "surface_real4_ceiling_open_public"
      ],
      "required_visual_criteria": [
        "intent_matches_image", "strong_pattern_competition", "wallpaper_wall_integrity",
        "wall_floor_color_relation", "same_room_wall_family"
      ],
      "capture_plan": [
        {
          "capture_id": "public_wallpaper",
          "tool": "observe_room",
          "room_id": "open_public",
          "focus_target_ids": [
            "wall_face_real4_002", "wall_face_real4_010", "wall_face_real4_013",
            "wall_face_real4_022", "wall_face_real4_028", "wall_face_real4_032",
            "surface_real4_floor_open_public"
          ],
          "minimum_image_count": 3,
          "covers_criteria": [
            "intent_matches_image", "strong_pattern_competition", "wallpaper_wall_integrity",
            "wall_floor_color_relation", "same_room_wall_family"
          ]
        }
      ],
      "grader_focus": "必须看清墙纸所在整面墙及相邻表面；漂亮的局部特写不能替代墙体完整度证据。"
    },
    {
      "scenario_id": "foyer_lengthwise_order_05",
      "title": "狭长玄关的纵向秩序",
      "tags": ["single_room", "foyer", "smoke", "direction"],
      "confirmed_requirements": [
        "范围仅为玄关",
        "希望狭长区域显得更连贯，不被横向强条纹切碎",
        "可以有轻微纵向肌理，但不能再叠加强地面图案",
        "整体明亮、整洁"
      ],
      "approved_plan": "玄关墙面使用浅暖中性底色，可在完整墙面加入低对比纵向织纹以加强长度方向；地面选择低色差、方向不抢眼的浅色材料；顶面保持简洁。禁止横向强条纹和第二种强图案，只修改玄关。",
      "allowed_room_ids": ["foyer"],
      "allowed_target_ids": [
        "wall_face_real4_004", "wall_face_real4_012",
        "surface_real4_floor_foyer", "surface_real4_ceiling_foyer"
      ],
      "required_visual_criteria": [
        "intent_matches_image", "strong_pattern_competition", "wall_floor_color_relation",
        "small_room_complexity", "corridor_stripe_direction"
      ],
      "capture_plan": [
        {
          "capture_id": "foyer",
          "tool": "observe_room",
          "room_id": "foyer",
          "focus_target_ids": [
            "wall_face_real4_004", "wall_face_real4_012",
            "surface_real4_floor_foyer", "surface_real4_ceiling_foyer"
          ],
          "minimum_image_count": 3,
          "covers_criteria": [
            "intent_matches_image", "strong_pattern_competition", "wall_floor_color_relation",
            "small_room_complexity", "corridor_stripe_direction"
          ]
        }
      ],
      "grader_focus": "从入口和返回方向都检查条纹/铺装方向，避免只用正面近景掩盖横向切割感。"
    },
    {
      "scenario_id": "public_dining_continuity_06",
      "title": "客餐厅连续的公共区",
      "tags": ["multi_room", "public", "smoke", "continuity"],
      "confirmed_requirements": [
        "范围为横厅客厅和餐厅",
        "两个连续空间的地面要像同一公共区，不得明显打架或割裂",
        "墙面使用协调的暖中性体系",
        "不设置多个视觉焦点"
      ],
      "approved_plan": "横厅客厅与餐厅使用同一种浅色低色差木地面，形成连续公共区；两个空间的墙面统一在暖白与浅 Greige 家族内，仅允许轻微层级差；顶面保持安静，不设置多个图案焦点。只修改横厅客厅和餐厅。",
      "allowed_room_ids": ["open_public", "dining_room"],
      "allowed_target_ids": [
        "wall_face_real4_002", "wall_face_real4_010", "wall_face_real4_013",
        "wall_face_real4_022", "wall_face_real4_028", "wall_face_real4_032",
        "surface_real4_floor_open_public", "surface_real4_ceiling_open_public",
        "wall_face_real4_005", "wall_face_real4_034",
        "surface_real4_floor_dining_room", "surface_real4_ceiling_dining_room"
      ],
      "required_visual_criteria": [
        "intent_matches_image", "adjacent_floor_color_harmony", "connected_floor_continuity",
        "strong_pattern_competition", "wall_floor_color_relation"
      ],
      "capture_plan": [
        {
          "capture_id": "public_room",
          "tool": "observe_room",